{"id":"cairn-offline-fake-v1","schema_version":1,"source":{"files":[{"content":"cairn-offline-fixture-v1\n","path":"fixture.txt"}],"identifier":"cairn-offline-fake-v1","kind":"bundled_fake"},"tasks":[{"id":"offline-pass-note","input":"Produce one deterministic note-producing result.","limits":{"elapsed_ms":5000,"stdout_bytes":16384},"prepare":{"args":["-e","process.exit(require('node:fs').readFileSync('fixture.txt','utf8')==='cairn-offline-fixture-v1\\n'?0:8)"],"program":"node"},"verify":{"args":["-e","process.exit(require('node:fs').existsSync('adapter-result.txt')?0:9)"],"program":"node"},"workspace":{"path":"."}},{"id":"offline-verifier-fail","input":"Produce a result rejected by the independent verifier.","limits":{"elapsed_ms":5000,"stdout_bytes":16384},"prepare":{"args":["-e","process.exit(require('node:fs').readFileSync('fixture.txt','utf8')==='cairn-offline-fixture-v1\\n'?0:8)"],"program":"node"},"verify":{"args":["-e","process.exit(9)"],"program":"node"},"workspace":{"path":"."}},{"id":"offline-missing-tokens","input":"Omit optional usage fields.","limits":{"elapsed_ms":5000,"stdout_bytes":16384},"prepare":{"args":["-e","process.exit(require('node:fs').readFileSync('fixture.txt','utf8')==='cairn-offline-fixture-v1\\n'?0:8)"],"program":"node"},"verify":{"args":["-e","process.exit(require('node:fs').existsSync('adapter-result.txt')?0:9)"],"program":"node"},"workspace":{"path":"."}},{"id":"offline-no-notes","input":"Close a trajectory with no distillable notes.","limits":{"elapsed_ms":5000,"stdout_bytes":16384},"prepare":{"args":["-e","process.exit(require('node:fs').readFileSync('fixture.txt','utf8')==='cairn-offline-fixture-v1\\n'?0:8)"],"program":"node"},"verify":{"args":["-e","process.exit(require('node:fs').existsSync('adapter-result.txt')?0:9)"],"program":"node"},"workspace":{"path":"."}},{"id":"offline-distillation-failure","input":"Expose an exact but unreadable trajectory store.","limits":{"elapsed_ms":5000,"stdout_bytes":16384},"prepare":{"args":["-e","process.exit(require('node:fs').readFileSync('fixture.txt','utf8')==='cairn-offline-fixture-v1\\n'?0:8)"],"program":"node"},"verify":{"args":["-e","process.exit(require('node:fs').existsSync('adapter-result.txt')?0:9)"],"program":"node"},"workspace":{"path":"."}},{"id":"offline-skipped-notes","input":"Complete without a trajectory reference.","limits":{"elapsed_ms":5000,"stdout_bytes":16384},"prepare":{"args":["-e","process.exit(require('node:fs').readFileSync('fixture.txt','utf8')==='cairn-offline-fixture-v1\\n'?0:8)"],"program":"node"},"verify":{"args":["-e","process.exit(require('node:fs').existsSync('adapter-result.txt')?0:9)"],"program":"node"},"workspace":{"path":"."}},{"id":"offline-timeout","input":"Exceed the declared adapter timeout.","limits":{"elapsed_ms":100,"stdout_bytes":16384},"prepare":{"args":["-e","process.exit(require('node:fs').readFileSync('fixture.txt','utf8')==='cairn-offline-fixture-v1\\n'?0:8)"],"program":"node"},"verify":{"args":["-e","process.exit(0)"],"program":"node"},"workspace":{"path":"."}},{"id":"offline-adapter-error","input":"Return a structured adapter error.","limits":{"elapsed_ms":5000,"stdout_bytes":16384},"prepare":{"args":["-e","process.exit(require('node:fs').readFileSync('fixture.txt','utf8')==='cairn-offline-fixture-v1\\n'?0:8)"],"program":"node"},"verify":{"args":["-e","process.exit(0)"],"program":"node"},"workspace":{"path":"."}},{"id":"offline-invalid-result","input":"Return a schema-invalid result.","limits":{"elapsed_ms":5000,"stdout_bytes":16384},"prepare":{"args":["-e","process.exit(require('node:fs').readFileSync('fixture.txt','utf8')==='cairn-offline-fixture-v1\\n'?0:8)"],"program":"node"},"verify":{"args":["-e","process.exit(0)"],"program":"node"},"workspace":{"path":"."}},{"id":"offline-cancellation-control","input":"Complete normally unless the cancellation control is enabled.","limits":{"elapsed_ms":5000,"stdout_bytes":16384},"prepare":{"args":["-e","process.exit(require('node:fs').readFileSync('fixture.txt','utf8')==='cairn-offline-fixture-v1\\n'?0:8)"],"program":"node"},"verify":{"args":["-e","process.exit(require('node:fs').existsSync('adapter-result.txt')?0:9)"],"program":"node"},"workspace":{"path":"."}}]}
